{"acceptance_policy":{"decisions":[],"notes":"German body text; the language is read from the page, not from the vendor name. An ISO date avoids a second ambiguity.","rules":{"A_line_amount":"PASS","B_subtotal":"PASS","C_total":"PASS","D_required_fields":"PASS"},"tax_rule":"APPLICABLE","upstream_validate":"OPTIONAL"},"annotation":{"generated_by":"docuagents_gen/fixtures.py (T15)","seed":2027,"source":"generator_recorded","verification":"generator_recorded"},"arithmetic":{"charges_printed":"0.00","delta_subtotal":"0.00","delta_total":"0.00","line_sum":"154.50","lines":[{"delta":"0.00","index":0,"printed_amount":"25.50","recomputed_amount":"25.50","status":"PASS"},{"delta":"0.00","index":1,"printed_amount":"60.00","recomputed_amount":"60.00","status":"PASS"},{"delta":"0.00","index":2,"printed_amount":"69.00","recomputed_amount":"69.00","status":"PASS"}],"printed_subtotal":"154.50","printed_total":"163.77","recomputed_total":"163.77","tax_printed":"9.27"},"class":"?","contract_version":"1.1","doc_id":"da-fx-lang","evidence":{"currency":{"bbox_precision":"approximate","bbox_pt":[555.0,118.8,574.0,127.98],"page":1,"searched_pages":[1],"status":"observed","text":"USD","verification":"generator_recorded"},"customer_name":{"page":1,"searched_pages":[1],"status":"observed","text":"Beacon Point Assembly Inc","verification":"generator_recorded"},"due_date":{"bbox_precision":"approximate","bbox_pt":[527.97,94.8,574.0,103.98],"page":1,"searched_pages":[1],"status":"observed","text":"2026-12-05","verification":"generator_recorded"},"invoice_date":{"bbox_precision":"approximate","bbox_pt":[527.97,82.8,574.0,91.98],"page":1,"searched_pages":[1],"status":"observed","text":"2026-11-05","verification":"generator_recorded"},"invoice_number":{"bbox_precision":"approximate","bbox_pt":[512.97,70.8,574.0,79.98],"page":1,"searched_pages":[1],"status":"observed","text":"INV-2027-2205","verification":"generator_recorded"},"line_items[0].amount":{"page":1,"searched_pages":[1],"status":"observed","text":"25.50","verification":"generator_recorded"},"line_items[0].quantity":{"page":1,"searched_pages":[1],"status":"observed","text":"6","verification":"generator_recorded"},"line_items[0].unit_price":{"page":1,"searched_pages":[1],"status":"observed","text":"4.25","verification":"generator_recorded"},"line_items[1].amount":{"page":1,"searched_pages":[1],"status":"observed","text":"60.00","verification":"generator_recorded"},"line_items[1].quantity":{"page":1,"searched_pages":[1],"status":"observed","text":"25","verification":"generator_recorded"},"line_items[1].unit_price":{"page":1,"searched_pages":[1],"status":"observed","text":"2.40","verification":"generator_recorded"},"line_items[2].amount":{"page":1,"searched_pages":[1],"status":"observed","text":"69.00","verification":"generator_recorded"},"line_items[2].quantity":{"page":1,"searched_pages":[1],"status":"observed","text":"2","verification":"generator_recorded"},"line_items[2].unit_price":{"page":1,"searched_pages":[1],"status":"observed","text":"34.50","verification":"generator_recorded"},"purchase_order_number":{"page":null,"searched_pages":[1],"status":"not_found","text":null,"verification":"generator_recorded"},"scope_signals.additional_charges":{"page":null,"searched_pages":[1],"status":"not_found","text":null,"verification":"generator_recorded"},"scope_signals.currency_evidence":{"page":1,"searched_pages":[1],"status":"observed","text":"Currency: USD","verification":"generator_recorded"},"scope_signals.discount":{"page":null,"searched_pages":[1],"status":"not_found","text":null,"verification":"generator_recorded"},"scope_signals.document_type":{"page":1,"searched_pages":[1],"status":"observed","text":"INVOICE","verification":"generator_recorded"},"scope_signals.invoice_count":{"page":1,"searched_pages":[1],"status":"observed","text":"Invoice labels: 1","verification":"generator_recorded"},"scope_signals.language":{"page":1,"searched_pages":[1],"status":"observed","text":"other","verification":"generator_recorded"},"scope_signals.observed_row_count":{"page":1,"searched_pages":[1],"status":"observed","text":"Rows observed: 3","verification":"generator_recorded"},"scope_signals.prepayment_or_prior_balance":{"page":null,"searched_pages":[1],"status":"not_found","text":null,"verification":"generator_recorded"},"scope_signals.table_layout":{"page":1,"searched_pages":[1],"status":"observed","text":"Rows on pages [1]","verification":"generator_recorded"},"scope_signals.table_pages":{"page":1,"searched_pages":[1],"status":"observed","text":"Pages with table rows: [1]","verification":"generator_recorded"},"scope_signals.tax_presentation":{"page":1,"searched_pages":[1],"status":"observed","text":"Sales Tax (6%)","verification":"generator_recorded"},"scope_signals.unit_price_basis":{"page":1,"searched_pages":[1],"status":"observed","text":"Sales Tax (6%)","verification":"generator_recorded"},"subtotal_amount":{"bbox_precision":"approximate","bbox_pt":[540.75,291.64,574.0,301.02],"page":1,"searched_pages":[1],"status":"observed","text":"$154.50","verification":"generator_recorded"},"tax_amount":{"bbox_precision":"approximate","bbox_pt":[550.98,307.64,574.0,317.02],"page":1,"searched_pages":[1],"status":"observed","text":"$9.27","verification":"generator_recorded"},"total_amount":{"bbox_precision":"approximate","bbox_pt":[536.05,326.6,574.0,337.31],"page":1,"searched_pages":[1],"status":"observed","text":"$163.77","verification":"generator_recorded"},"vendor_name":{"page":1,"searched_pages":[1],"status":"observed","text":"Lumen Carton Systems Inc","verification":"generator_recorded"}},"expected_issues":[],"expected_status":"needs_review","file":{"file_name":"documents/da-fx-lang.pdf","media_type":"application/pdf","page_count":1,"sha256":"1111fe3d487e69f4c5925764501e3462ad67ed28039f1cc058040f778c36ad83"},"invoice":{"charges":[],"currency":"USD","customer_name":"Beacon Point Assembly Inc","document_type":"invoice","due_date":"2026-12-05","invoice_date":"2026-11-05","invoice_number":"INV-2027-2205","line_items":[{"amount":"25.50","description":"Packing tape, 48 mm x 66 m","index":0,"quantity":"6","unit_price":"4.25"},{"amount":"60.00","description":"Corrugated cartons, 400 x 300 x 300 mm","index":1,"quantity":"25","unit_price":"2.40"},{"amount":"69.00","description":"Stretch film, 500 mm x 300 m","index":2,"quantity":"2","unit_price":"34.50"}],"purchase_order_number":null,"subtotal_amount":"154.50","tax_amount":"9.27","total_amount":"163.77","vendor_name":"Lumen Carton Systems Inc"},"must_not_auto_accept":true,"printing":{"currency_header":"Currency: USD","currency_symbol":"$","date_form":"ISO","tax_note":null},"readability":{"gate":"clean_text","note":"Fixture readability is prefilled from the construction; the human confirmation is recorded in reports/legibility_review.json (Gate 2 / T17).","verified":false},"schema_version":2,"scope":{"reasons":["NON_ENGLISH"],"signals":{"additional_charges":"absent","currency_evidence":"explicit","discount":"absent","document_type":"invoice","invoice_count":1,"language":"other","observed_row_count":3,"prepayment_or_prior_balance":"absent","table_layout":"single_page","table_pages":[1],"tax_presentation":"single","unit_price_basis":"pre_tax"},"status":"UNSUPPORTED"},"source_family":"fixture_language","split":"unassigned","subclass":"fixture","target_question":"German body text; the language is read from the page, not from the vendor name. An ISO date avoids a second ambiguity."}