{"acceptance_policy":{"decisions":[],"notes":"All applicable rules pass on the printed values.","rules":{"A_line_amount":"PASS","B_subtotal":"PASS","C_total":"PASS","D_required_fields":"PASS"},"tax_rule":"APPLICABLE","upstream_validate":"APPLICABLE"},"annotation":{"generated_by":"docuagents_gen/gold.py (T07)","seed":2026,"source":"generator_recorded","verification":"generator_recorded"},"arithmetic":{"charges_printed":"0.00","delta_subtotal":"0.00","delta_total":"0.00","line_sum":"85.50","lines":[{"delta":"0.00","index":0,"printed_amount":"25.50","recomputed_amount":"25.50","status":"PASS"},{"delta":"0.00","index":1,"printed_amount":"60.00","recomputed_amount":"60.00","status":"PASS"}],"printed_subtotal":"85.50","printed_total":"90.63","recomputed_total":"90.63","tax_printed":"5.13"},"class":"B","contract_version":"1.1","doc_id":"da-b3-02","evidence":{"currency":{"bbox_precision":"unavailable","page":1,"searched_pages":[1],"status":"observed","text":"USD","verification":"generator_recorded"},"customer_name":{"bbox_precision":"unavailable","page":1,"searched_pages":[1],"status":"observed","text":"Alder Creek Mills","verification":"generator_recorded"},"due_date":{"bbox_precision":"unavailable","page":1,"searched_pages":[1],"status":"observed","text":"July 17, 2026","verification":"generator_recorded"},"invoice_date":{"bbox_precision":"unavailable","page":1,"searched_pages":[1],"status":"observed","text":"June 17, 2026","verification":"generator_recorded"},"invoice_number":{"bbox_precision":"unavailable","page":1,"searched_pages":[1],"status":"observed","text":"INV-2026-1508","verification":"generator_recorded"},"line_items[0].amount":{"page":1,"searched_pages":[1],"status":"observed","text":"25.50","verification":"generator_recorded"},"line_items[0].quantity":{"page":1,"searched_pages":[1],"status":"observed","text":"6","verification":"generator_recorded"},"line_items[0].unit_price":{"page":1,"searched_pages":[1],"status":"observed","text":"4.25","verification":"generator_recorded"},"line_items[1].amount":{"page":1,"searched_pages":[1],"status":"observed","text":"60.00","verification":"generator_recorded"},"line_items[1].quantity":{"page":1,"searched_pages":[1],"status":"observed","text":"25","verification":"generator_recorded"},"line_items[1].unit_price":{"page":1,"searched_pages":[1],"status":"observed","text":"2.40","verification":"generator_recorded"},"purchase_order_number":{"page":null,"searched_pages":[1],"status":"not_found","text":null,"verification":"generator_recorded"},"scope_signals.additional_charges":{"page":null,"searched_pages":[1],"status":"not_found","text":null,"verification":"generator_recorded"},"scope_signals.currency_evidence":{"bbox_precision":"unavailable","page":1,"searched_pages":[1],"status":"observed","text":"Currency: USD","verification":"generator_recorded"},"scope_signals.discount":{"page":null,"searched_pages":[1],"status":"not_found","text":null,"verification":"generator_recorded"},"scope_signals.document_type":{"bbox_precision":"unavailable","page":1,"searched_pages":[1],"status":"observed","text":"INVOICE","verification":"generator_recorded"},"scope_signals.invoice_count":{"page":1,"searched_pages":[1],"status":"observed","text":"Invoice labels: 1","verification":"generator_recorded"},"scope_signals.language":{"bbox_precision":"unavailable","page":1,"searched_pages":[1],"status":"observed","text":"INVOICE","verification":"generator_recorded"},"scope_signals.observed_row_count":{"page":1,"searched_pages":[1],"status":"observed","text":"Rows observed: 2","verification":"generator_recorded"},"scope_signals.prepayment_or_prior_balance":{"page":null,"searched_pages":[1],"status":"not_found","text":null,"verification":"generator_recorded"},"scope_signals.table_layout":{"page":1,"searched_pages":[1],"status":"observed","text":"Rows on pages [1]","verification":"generator_recorded"},"scope_signals.table_pages":{"page":1,"searched_pages":[1],"status":"observed","text":"Pages with table rows: [1]","verification":"generator_recorded"},"scope_signals.tax_presentation":{"bbox_precision":"unavailable","page":1,"searched_pages":[1],"status":"observed","text":"Sales Tax (6%)","verification":"generator_recorded"},"scope_signals.unit_price_basis":{"bbox_precision":"unavailable","page":1,"searched_pages":[1],"status":"observed","text":"Prices exclude tax.","verification":"generator_recorded"},"subtotal_amount":{"bbox_precision":"unavailable","page":1,"searched_pages":[1],"status":"observed","text":"$85.50","verification":"generator_recorded"},"tax_amount":{"bbox_precision":"unavailable","page":1,"searched_pages":[1],"status":"observed","text":"$5.13","verification":"generator_recorded"},"total_amount":{"bbox_precision":"unavailable","page":1,"searched_pages":[1],"status":"observed","text":"$90.63","verification":"generator_recorded"},"vendor_name":{"bbox_precision":"unavailable","page":1,"searched_pages":[1],"status":"observed","text":"Cedarworks Tools Inc","verification":"generator_recorded"}},"expected_issues":[],"file":{"file_name":"documents/da-b3-02.png","media_type":"image/png","page_count":1,"sha256":"15add75abeb250cc21118b21ded753853c4b7dcaff0f73574f4c680945c49177"},"invoice":{"charges":[],"currency":"USD","customer_name":"Alder Creek Mills","document_type":"invoice","due_date":"2026-07-17","invoice_date":"2026-06-17","invoice_number":"INV-2026-1508","line_items":[{"amount":"25.50","description":"Packing tape, 48 mm x 66 m","index":0,"quantity":"6","unit_price":"4.25"},{"amount":"60.00","description":"Corrugated cartons, 400 x 300 x 300 mm","index":1,"quantity":"25","unit_price":"2.40"}],"purchase_order_number":null,"subtotal_amount":"85.50","tax_amount":"5.13","total_amount":"90.63","vendor_name":"Cedarworks Tools Inc"},"printing":{"currency_header":"Currency: USD","currency_symbol":"$","date_form":"USLONG","tax_note":"Prices exclude tax."},"readability":{"gate":"image_degraded_unverified","note":"Final legibility freeze is a T17 annotation check; this task prefills the gate.","verified":false},"schema_version":2,"scope":{"reasons":[],"signals":{"additional_charges":"absent","currency_evidence":"explicit","discount":"absent","document_type":"invoice","invoice_count":1,"language":"en","observed_row_count":2,"prepayment_or_prior_balance":"absent","table_layout":"single_page","table_pages":[1],"tax_presentation":"single","unit_price_basis":"pre_tax"},"status":"SUPPORTED"},"source_family":"degraded_scan","split":"test","subclass":"B3","target_question":"重降质下不可读字段是否被如实标记而不是猜测？"}