{"acceptance_policy":{"decisions":["MISSING_REQUIRED_FIELD"],"notes":"The line-item table prints no rows. Zero rows is a missing amount, not a row-limit problem.","rules":{"A_line_amount":"NOT_APPLICABLE","B_subtotal":"PASS","C_total":"PASS","D_required_fields":"FAIL"},"tax_rule":"NOT_APPLICABLE","upstream_validate":"OPTIONAL"},"annotation":{"generated_by":"docuagents_gen/fixtures.py (T15)","seed":2027,"source":"generator_recorded","verification":"generator_recorded"},"arithmetic":{"charges_printed":"0.00","delta_subtotal":"0.00","delta_total":"0.00","line_sum":"0.00","lines":[],"printed_subtotal":"0.00","printed_total":"0.00","recomputed_total":"0.00","tax_printed":null},"class":"?","contract_version":"1.1","doc_id":"da-fx-empty","evidence":{"currency":{"bbox_precision":"approximate","bbox_pt":[555.0,118.8,574.0,127.98],"page":1,"searched_pages":[1],"status":"observed","text":"USD","verification":"generator_recorded"},"customer_name":{"page":1,"searched_pages":[1],"status":"observed","text":"Fieldstone Marine LLC","verification":"generator_recorded"},"due_date":{"bbox_precision":"approximate","bbox_pt":[492.95,94.8,574.0,103.98],"page":1,"searched_pages":[1],"status":"observed","text":"December 10, 2026","verification":"generator_recorded"},"invoice_date":{"bbox_precision":"approximate","bbox_pt":[492.46,82.8,574.0,91.98],"page":1,"searched_pages":[1],"status":"observed","text":"November 10, 2026","verification":"generator_recorded"},"invoice_number":{"bbox_precision":"approximate","bbox_pt":[512.97,70.8,574.0,79.98],"page":1,"searched_pages":[1],"status":"observed","text":"INV-2027-2210","verification":"generator_recorded"},"purchase_order_number":{"page":null,"searched_pages":[1],"status":"not_found","text":null,"verification":"generator_recorded"},"scope_signals.additional_charges":{"page":null,"searched_pages":[1],"status":"not_found","text":null,"verification":"generator_recorded"},"scope_signals.currency_evidence":{"page":1,"searched_pages":[1],"status":"observed","text":"Currency: USD","verification":"generator_recorded"},"scope_signals.discount":{"page":null,"searched_pages":[1],"status":"not_found","text":null,"verification":"generator_recorded"},"scope_signals.document_type":{"page":1,"searched_pages":[1],"status":"observed","text":"INVOICE","verification":"generator_recorded"},"scope_signals.invoice_count":{"page":1,"searched_pages":[1],"status":"observed","text":"Invoice labels: 1","verification":"generator_recorded"},"scope_signals.language":{"page":1,"searched_pages":[1],"status":"observed","text":"en","verification":"generator_recorded"},"scope_signals.observed_row_count":{"page":1,"searched_pages":[1],"status":"observed","text":"Rows observed: 0","verification":"generator_recorded"},"scope_signals.prepayment_or_prior_balance":{"page":null,"searched_pages":[1],"status":"not_found","text":null,"verification":"generator_recorded"},"scope_signals.table_layout":{"page":1,"searched_pages":[1],"status":"observed","text":"No table rows","verification":"generator_recorded"},"scope_signals.table_pages":{"page":1,"searched_pages":[1],"status":"observed","text":"Pages with table rows: []","verification":"generator_recorded"},"scope_signals.tax_presentation":{"page":null,"searched_pages":[1],"status":"not_found","text":null,"verification":"generator_recorded"},"scope_signals.unit_price_basis":{"page":1,"searched_pages":[1],"status":"observed","text":"Prices exclude tax.","verification":"generator_recorded"},"subtotal_amount":{"bbox_precision":"approximate","bbox_pt":[550.98,246.64,574.0,256.02],"page":1,"searched_pages":[1],"status":"observed","text":"$0.00","verification":"generator_recorded"},"tax_amount":{"page":null,"searched_pages":[1],"status":"not_found","text":null,"verification":"generator_recorded"},"total_amount":{"bbox_precision":"approximate","bbox_pt":[547.73,265.6,574.0,276.31],"page":1,"searched_pages":[1],"status":"observed","text":"$0.00","verification":"generator_recorded"},"vendor_name":{"page":1,"searched_pages":[1],"status":"observed","text":"Granite Harbor Supply Co","verification":"generator_recorded"}},"expected_issues":["MISSING_REQUIRED_FIELD"],"expected_status":"needs_review","file":{"file_name":"documents/da-fx-empty.pdf","media_type":"application/pdf","page_count":1,"sha256":"626030cf9b43e9b85bfbb94e9dab20686f35072ffc457d30f2314a9eea13c804"},"invoice":{"charges":[],"currency":"USD","customer_name":"Fieldstone Marine LLC","document_type":"invoice","due_date":"2026-12-10","invoice_date":"2026-11-10","invoice_number":"INV-2027-2210","line_items":[],"purchase_order_number":null,"subtotal_amount":"0.00","tax_amount":null,"total_amount":"0.00","vendor_name":"Granite Harbor Supply Co"},"must_not_auto_accept":true,"printing":{"currency_header":"Currency: USD","currency_symbol":"$","date_form":"USLONG","tax_note":"Prices exclude tax."},"readability":{"gate":"clean_text","note":"Fixture readability is prefilled from the construction; the human confirmation is recorded in reports/legibility_review.json (Gate 2 / T17).","verified":false},"schema_version":2,"scope":{"reasons":[],"signals":{"additional_charges":"absent","currency_evidence":"explicit","discount":"absent","document_type":"invoice","invoice_count":1,"language":"en","observed_row_count":0,"prepayment_or_prior_balance":"absent","table_layout":"single_page","table_pages":[],"tax_presentation":"missing","unit_price_basis":"pre_tax"},"status":"SUPPORTED"},"source_family":"fixture_limits","split":"unassigned","subclass":"fixture","target_question":"The line-item table prints no rows. Zero rows is a missing amount, not a row-limit problem."}